{
  "source": "manual",
  "captured_at": "2099-03-11T14:00:00Z",
  "text": "Astronomy is not about owning the most gear. The 70mm refractor I started with twenty years ago still shows everything I listed in my first logbook. The skill is in the patience.",
  "url": "https://example.test/acmecosmos/status/cs-own-004",
  "trust_class": "untrusted-scraped",
  "retention_class": "standard",
  "metrics": { "likes": 540, "replies": 24, "reposts": 67, "bookmarks": 310, "impressions": 43000 }
}
