{
  "source": "export",
  "captured_at": "2099-01-04T22:10:00Z",
  "text": "Introducing the ST-1 first-light walkthrough in the app. Six taps: pick tonight's object, align the red dot, find, focus, look, save. Box open to a real object in under five minutes.",
  "url": "https://example.test/acmecosmos/status/own-001",
  "trust_class": "untrusted-scraped",
  "retention_class": "standard",
  "metrics": { "likes": 412, "replies": 28, "reposts": 61, "bookmarks": 140, "impressions": 38200 }
}
