{
  "source": "platform",
  "captured_at": "2099-03-05T20:00:00Z",
  "text": "How to find the Andromeda Galaxy in 4 steps: 1) face the Square of Pegasus, 2) hop to Mirach, 3) two stars up, 4) scan slow at low power. The smudge is a trillion suns.",
  "url": "https://example.test/orbitoutfitters/status/cs-comp-002",
  "trust_class": "untrusted-scraped",
  "retention_class": "transient",
  "metrics": { "likes": 1980, "replies": 70, "reposts": 260, "bookmarks": 1450, "impressions": 118000 }
}
