{
  "source": "platform",
  "captured_at": "2099-02-02T18:00:00Z",
  "text": "🚨 BIGGEST telescope launch of the YEAR is coming. You are NOT ready. Soon. 👀",
  "url": "https://example.test/stellaroptics/status/stellar-001",
  "trust_class": "untrusted-scraped",
  "retention_class": "transient",
  "metrics": { "likes": 88, "replies": 12, "reposts": 9, "bookmarks": 4, "impressions": 21000 }
}
