{
  "source": "manual",
  "captured_at": "2099-01-19T22:50:00Z",
  "text": "First time my kid found Saturn's rings on their own. The pause, then the quiet 'whoa.' That's the whole reason we built this.",
  "url": "https://example.test/acmecosmos/status/own-006",
  "trust_class": "untrusted-scraped",
  "retention_class": "standard",
  "metrics": { "likes": 2210, "replies": 96, "reposts": 305, "bookmarks": 410, "impressions": 158000 }
}
