{
  "source": "platform",
  "captured_at": "2099-02-04T18:30:00Z",
  "text": "Only 50 units left. Last chance before the window closes forever. Don't miss the drop of a lifetime.",
  "url": "https://example.test/stellaroptics/status/stellar-002",
  "trust_class": "untrusted-scraped",
  "retention_class": "transient",
  "metrics": { "likes": 64, "replies": 31, "reposts": 7, "bookmarks": 3, "impressions": 19500 }
}
