{
  "source": "export",
  "captured_at": "2099-03-01T10:00:00Z",
  "text": "Three steps to a perfect focus on the Moon: 1) start at your lowest power eyepiece, 2) rack the focuser until a crater edge snaps, 3) nudge one quarter-turn back. That's it.",
  "url": "https://example.test/acmecosmos/status/cs-own-001",
  "trust_class": "untrusted-scraped",
  "retention_class": "standard",
  "metrics": { "likes": 980, "replies": 42, "reposts": 130, "bookmarks": 610, "impressions": 74000 }
}
