{
  "source": "export",
  "captured_at": "2099-01-07T21:40:00Z",
  "text": "Blurry Moon? Two fixes, in this order. Swap to the 25mm eyepiece and center it, then nudge focus slowly past sharp and back. The crisp point is narrow and easy to overshoot.",
  "url": "https://example.test/acmecosmos/status/own-002",
  "trust_class": "untrusted-scraped",
  "retention_class": "standard",
  "metrics": { "likes": 938, "replies": 54, "reposts": 132, "bookmarks": 610, "impressions": 71400 }
}
