{
  "source": "platform",
  "captured_at": "2099-02-05T20:30:00Z",
  "text": "The terminator is where the craters live. Aim at the day-night line, not the bright full face, for the sharpest shadows.",
  "url": "https://example.test/orbitoutfitters/status/orbit-002",
  "trust_class": "untrusted-scraped",
  "retention_class": "transient",
  "metrics": { "likes": 940, "replies": 34, "reposts": 120, "bookmarks": 580, "impressions": 67000 }
}
