{
  "source": "platform",
  "captured_at": "2099-03-12T19:00:00Z",
  "text": "The terminator is the best place to look. Aim at the day-night boundary on the Moon — the shadows make craters look three-dimensional. Always worth five minutes at high power.",
  "url": "https://example.test/orbitoutfitters/status/cs-comp-004",
  "trust_class": "untrusted-scraped",
  "retention_class": "transient",
  "metrics": { "likes": 860, "replies": 29, "reposts": 105, "bookmarks": 490, "impressions": 61000 }
}
