{
  "source": "export",
  "captured_at": "2099-01-13T22:15:00Z",
  "text": "Drove an hour for dark sky and the clouds rolled in at 9:58. We still caught fifteen minutes on the Pleiades through the gap. Faint counts.",
  "url": "https://example.test/acmecosmos/status/own-004",
  "trust_class": "untrusted-scraped",
  "retention_class": "standard",
  "metrics": { "likes": 640, "replies": 39, "reposts": 44, "bookmarks": 88, "impressions": 41200 }
}
