{
  "source": "export",
  "captured_at": "2099-01-16T20:30:00Z",
  "text": "We ship a 25mm eyepiece as the default, not a high-power one. Wide and bright first means you actually find the thing. The 10mm is in the box for when you're ready to zoom in.",
  "url": "https://example.test/acmecosmos/status/own-005",
  "trust_class": "untrusted-scraped",
  "retention_class": "standard",
  "metrics": { "likes": 521, "replies": 33, "reposts": 70, "bookmarks": 210, "impressions": 44900 }
}
