{
  "source": "manual",
  "captured_at": "2099-01-25T21:30:00Z",
  "text": "Astronomy, not astrology. We will never tell you what the stars mean for your week. We'll tell you which one is a planet and how to point at it.",
  "url": "https://example.test/acmecosmos/status/own-008",
  "trust_class": "operator-curated",
  "retention_class": "retained",
  "metrics": { "likes": 3380, "replies": 210, "reposts": 690, "bookmarks": 980, "impressions": 240500 },
  "attestation": {
    "promoted_by": "fixture-maintainer",
    "promoted_at": "2099-01-26T09:00:00Z",
    "reason": "Brand-voice north-star line, authored in-house for the fixture; safe to reuse verbatim as a values statement."
  }
}
