{
  "source": "export",
  "captured_at": "2099-03-04T09:30:00Z",
  "text": "Saturn is up after midnight this week. With the 10mm eyepiece you can see the ring gap — the Cassini Division — as a thin dark line. Takes about five minutes to find once you know where to look.",
  "url": "https://example.test/acmecosmos/status/cs-own-002",
  "trust_class": "untrusted-scraped",
  "retention_class": "standard",
  "metrics": { "likes": 1420, "replies": 58, "reposts": 198, "bookmarks": 830, "impressions": 112000 }
}
