{
  "source": "platform",
  "captured_at": "2099-02-09T19:30:00Z",
  "text": "On collimation: most beginners overthink it. A thirty-second laser check before each session is all a starter scope needs. Here's why the fear is overblown.",
  "url": "https://example.test/orbitoutfitters/status/orbit-004",
  "trust_class": "untrusted-scraped",
  "retention_class": "transient",
  "metrics": { "likes": 760, "replies": 41, "reposts": 95, "bookmarks": 470, "impressions": 58000 }
}
