{
  "source": "export",
  "captured_at": "2099-01-10T23:05:00Z",
  "text": "Clear sky tonight? Point low at the eastern horizon after 9. The steady dot that doesn't twinkle is Jupiter. With the 25mm eyepiece you'll catch up to four of its moons in a tidy little line.",
  "url": "https://example.test/acmecosmos/status/own-003",
  "trust_class": "untrusted-scraped",
  "retention_class": "standard",
  "metrics": { "likes": 1204, "replies": 71, "reposts": 188, "bookmarks": 540, "impressions": 96800 }
}
