{
  "source": "platform",
  "captured_at": "2099-02-08T17:45:00Z",
  "text": "GIVEAWAY! 🎉 RT + tag three friends to win a NovaMax. Winner picked tomorrow. Wen prize? Soon.",
  "url": "https://example.test/stellaroptics/status/stellar-004",
  "trust_class": "untrusted-scraped",
  "retention_class": "transient",
  "metrics": { "likes": 510, "replies": 880, "reposts": 430, "bookmarks": 6, "impressions": 60000 }
}
