{
  "source": "export",
  "captured_at": "2099-01-22T21:20:00Z",
  "text": "Three minutes to a sharp Moon, every time: tabletop down, red-dot on the Moon, 25mm in, focus slow, then swap to the 10mm once it's centered.",
  "url": "https://example.test/acmecosmos/status/own-007",
  "trust_class": "untrusted-scraped",
  "retention_class": "standard",
  "metrics": { "likes": 1102, "replies": 47, "reposts": 176, "bookmarks": 720, "impressions": 84300 }
}
