{
  "source": "platform",
  "captured_at": "2099-03-08T21:30:00Z",
  "text": "🚨 BIG launch incoming. The scope everyone has been waiting for. Soon. Very soon. 👀",
  "url": "https://example.test/orbitoutfitters/status/cs-comp-003",
  "trust_class": "untrusted-scraped",
  "retention_class": "transient",
  "metrics": { "likes": 110, "replies": 38, "reposts": 14, "bookmarks": 8, "impressions": 28000 }
}
