{
  "source": "platform",
  "captured_at": "2099-03-02T18:00:00Z",
  "text": "HUGE sale ends TONIGHT. You are NOT prepared for this deal. Last 30 units. Don't let another clear sky pass you by without the gear you deserve.",
  "url": "https://example.test/orbitoutfitters/status/cs-comp-001",
  "trust_class": "untrusted-scraped",
  "retention_class": "transient",
  "metrics": { "likes": 92, "replies": 47, "reposts": 11, "bookmarks": 6, "impressions": 24000 }
}
